train,stations
train_3,"[Haarlem, Amsterdam Sloterdijk, Amsterdam Centraal, Amsterdam Amstel, Amsterdam Zuid]"
train_4,"[Dordrecht, Rotterdam Centraal]"
train_5,"[Alkmaar, Castricum, Zaandam, Hoorn, Alkmaar, Den Helder]"
train_2,"[Beverwijk, Zaandam, Amsterdam Sloterdijk, Amsterdam Zuid, Schiphol Airport, Leiden Centraal, Heemstede-Aerdenhout, Haarlem, Beverwijk, Castricum]"
train_1,"[Gouda, Den Haag Centraal, Leiden Centraal, Alphen a/d Rijn, Gouda, Rotterdam Alexander, Rotterdam Centraal, Schiedam Centrum, Delft, Den Haag Centraal]"
score,9119.0
